{
  "document": {
    "publicationDate": "2024-07-20T20:00:00.001Z",
    "documentName": "This is a document name",
    "version": "This is a document version"
  },
  "venue": {
    "venueName": "This is the venue name",
    "venueAddress": {
      "line": [
        "Address Line 1"
      ],
      "town": "Venue Town",
      "county": "Venue County",
      "postCode": "AA1 AA1"
    },
    "venueContact": {
      "venueTelephone": "01234 123 123",
      "venueEmail": "a@b.com"
    }
  },
  "locationDetails": {
    "jurisdiction": "Family"
  },
  "courtLists": [
    {
      "courtHouse": {
        "courtHouseName": "This is the site name",
        "courtHouseContact": {
          "venueTelephone": "01234 123 123",
          "venueEmail": "a@b.com"
        },
        "courtHouseAddress": {
          "line": [
            "Address Line 1"
          ],
          "postCode": "AA1 AA1"
        },
        "courtRoom": [
          {
            "courtRoomName": "This is the court room name",
            "session": [
              {
                "sittings": [
                  {
                    "sittingStart": "2024-07-21T10:00:00.001Z",
                    "sittingEnd": "2024-07-21T11:30:00.001Z",
                    "hearing": [
                      {
                        "hearingType": "Directions",
                        "case": [
                          {
                            "caseName": "This is a case name",
                            "caseNumber": "12341234",
                            "caseJurisdictionET": "Family Law",
                            "caseSequenceIndicator": "2 of 3",
                            "caseType": "Case type",
                            "reportingRestrictionDetail": [
                              "Reporting restriction 1",
                              "Reporting restriction 2"
                            ],
                            "party": [
                              {
                                "partyRole": "APPLICANT_PETITIONER",
                                "individualDetails": {
                                  "individualSurname": "Surname"
                                }
                              },
                              {
                                "partyRole": "RESPONDENT",
                                "organisationDetails": {
                                  "organisationName": "OrganisationName"
                                }
                              },
                              {
                                "partyRole": "APPLICANT_PETITIONER_REPRESENTATIVE",
                                "friendlyRoleName": "Legal Advisor",
                                "individualDetails": {
                                  "individualForenames": "Individual Forenames",
                                  "individualMiddleName": "Individual Middlename",
                                  "individualSurname": "Individual Surname",
                                  "title": "Mr"
                                }
                              },
                              {
                                "partyRole": "RESPONDENT_REPRESENTATIVE",
                                "friendlyRoleName": "Legal Advisor",
                                "individualDetails": {
                                  "individualForenames": "Individual Forenames",
                                  "individualMiddleName": "Individual Middlename",
                                  "individualSurname": "Individual Surname",
                                  "title": "Mr"
                                }
                              }
                            ]
                          },
                          {
                            "caseName": "This is a case name 2",
                            "caseNumber": "12341235",
                            "caseJurisdictionET": "Family Law",
                            "caseSequenceIndicator": "2 of 3",
                            "caseType": "Case type",
                            "reportingRestrictionDetail": [
                              "Reporting restriction 1",
                              "Reporting restriction 2"
                            ],
                            "party": [
                              {
                                "partyRole": "APPLICANT_PETITIONER",
                                "individualDetails": {
                                  "individualSurname": "Surname"
                                }
                              },
                              {
                                "partyRole": "RESPONDENT",
                                "organisationDetails": {
                                  "organisationName": "OrganisationName"
                                }
                              },
                              {
                                "partyRole": "APPLICANT_PETITIONER_REPRESENTATIVE",
                                "friendlyRoleName": "Legal Advisor",
                                "individualDetails": {
                                  "individualForenames": "Individual Forenames",
                                  "individualMiddleName": "Individual Middlename",
                                  "individualSurname": "Individual Surname",
                                  "title": "Mr"
                                }
                              },
                              {
                                "partyRole": "RESPONDENT_REPRESENTATIVE",
                                "friendlyRoleName": "Legal Advisor",
                                "individualDetails": {
                                  "individualForenames": "Individual Forenames",
                                  "individualMiddleName": "Individual Middlename",
                                  "individualSurname": "Individual Surname",
                                  "title": "Mr"
                                }
                              }
                            ]
                          },
                          {
                            "caseName": "This is another case name",
                            "caseNumber": "12341236",
                            "caseJurisdictionET": "Family Law",
                            "caseSequenceIndicator": "2 of 3",
                            "caseType": "Case type",
                            "reportingRestrictionDetail": [
                              "Reporting restriction 1",
                              "Reporting restriction 2"
                            ],
                            "party": [
                              {
                                "partyRole": "APPLICANT_PETITIONER",
                                "individualDetails": {
                                  "individualSurname": "Surname"
                                }
                              },
                              {
                                "partyRole": "RESPONDENT",
                                "organisationDetails": {
                                  "organisationName": "OrganisationName"
                                }
                              },
                              {
                                "partyRole": "APPLICANT_PETITIONER_REPRESENTATIVE",
                                "friendlyRoleName": "Legal Advisor",
                                "individualDetails": {
                                  "individualForenames": "Individual Forenames",
                                  "individualMiddleName": "Individual Middlename",
                                  "individualSurname": "Individual Surname",
                                  "title": "Mr"
                                }
                              },
                              {
                                "partyRole": "RESPONDENT_REPRESENTATIVE",
                                "friendlyRoleName": "Legal Advisor",
                                "individualDetails": {
                                  "individualForenames": "Individual Forenames",
                                  "individualMiddleName": "Individual Middlename",
                                  "individualSurname": "Individual Surname",
                                  "title": "Mr"
                                }
                              }
                            ]
                          }
                        ]
                      }
                    ],
                    "channel": [
                      "Teams",
                      "Attended"
                    ]
                  }
                ],
                "judiciary": [
                  {
                    "johKnownAs": "Judge TestName Presiding",
                    "isPresiding": true
                  },
                  {
                    "johKnownAs": "Judge TestName",
                    "isPresiding": false
                  }
                ]
              }
            ]
          }
        ]
      }
    }
  ]
}
