{
  "document": {
    "publicationDate": "2023-03-03T14:07:33.871502Z",
    "documentName": "This is a document name",
    "version": "This is a document version"
  },
  "venue": {
    "venueName": "This is the venue name",
    "venueAddress": {
      "line": [
        "Address Line 1"
      ],
      "town": "Venue Town",
      "county": "Venue County",
      "postCode": "AA1 AA1"
    },
    "venueContact": {
      "venueTelephone": "01234 123 123",
      "venueEmail": "a@b.com"
    }
  },
  "locationDetails": {
    "jurisdiction": "Family"
  },
  "courtLists": [
    {
      "courtHouse": {
        "courtHouseName": "This is the site name",
        "courtHouseContact": {
          "venueTelephone": "01234 123 123",
          "venueEmail": "a@b.com"
        },
        "courtHouseAddress": {
          "line": [
            "Address Line 1"
          ],
          "postCode": "AA1 AA1"
        },
        "courtRoom": [
          {
            "courtRoomName": "This is the court room name",
            "session": [
              {
                "sittings": [
                  {
                    "sittingStart": "2023-03-03T14:09:30.871502Z",
                    "sittingEnd": "2023-03-03T14:10:30.871502Z",
                    "hearing": [
                      {
                        "hearingType": "Directions",
                        "case": [
                          {
                            "reportingRestrictionDetail": [
                              "Reporting Restriction detail line 1",
                              "Reporting restriction detail line 2"
                            ],
                            "caseNumber": "12341234",
                            "caseLinked": [
                              {
                                "caseId": "1234",
                                "name": "A Vs B"
                              }
                            ],
                            "caseSequenceIndicator": "2 of 3"
                          }
                        ],
                        "party": [
                          {
                            "partyRole": "DEFENDANT",
                            "individualDetails": {
                              "individualSurname": "Surname",
                              "individualForenames": "Forenames"
                            }
                          },
                          {
                            "partyRole": "PROSECUTING_AUTHORITY",
                            "organisationDetails": {
                              "organisationName": "Org name"
                            }
                          }
                        ]
                      }
                    ],
                    "channel": [
                      "Teams",
                      "Attended"
                    ]
                  }
                ],
                "judiciary": [
                  {
                    "johTitle": "Judge",
                    "johNameSurname": "Test Name",
                    "role": "JUDGE",
                    "johKnownAs": "Judge Test Name",
                    "isPresiding": true
                  },
                  {
                    "johTitle": "Magistrate",
                    "johNameSurname": "Test Name",
                    "role": "MAGISTRATE",
                    "isPresiding": false
                  }
                ]
              }
            ]
          }
        ]
      }
    }
  ]
}
