{
  "document": {
    "publicationDate": "2024-07-20T20:00:00.001Z",
    "documentName": "This is a document name",
    "version": "This is a document version"
  },
  "venue": {
    "venueName": "This is the venue name",
    "venueAddress": {
      "line": [
        "Address Line 1"
      ],
      "town": "Venue Town",
      "county": "Venue County",
      "postCode": "AA1 AA1"
    },
    "venueContact": {
      "venueTelephone": "01234 123 123",
      "venueEmail": "a@b.com"
    }
  },
  "locationDetails": {
    "jurisdiction": "Family"
  },
  "courtLists": [
    {
      "courtHouse": {
        "courtHouseName": "This is the site name",
        "courtHouseContact": {
          "venueTelephone": "01234 123 123",
          "venueEmail": "a@b.com"
        },
        "courtHouseAddress": {
          "line": [
            "Address Line 1"
          ],
          "postCode": "AA1 AA1"
        },
        "courtRoom": [
          {
            "courtRoomName": "This is the court room name",
            "session": [
              {
                "sittings": [
                  {
                    "sittingStart": "2024-07-21T10:00:00.001Z",
                    "sittingEnd": "2024-07-21T11:30:00.001Z",
                    "hearing": [
                      {
                        "hearingType": "Directions",
                        "case": [
                          {
                            "caseNumber": "12341234",
                            "reportingRestrictionDetail": [
                              "Reporting Restriction detail line 1",
                              "Reporting restriction detail line 2"
                            ],
                            "caseLinked": [
                              {
                                "caseId": "1234",
                                "name": "A Vs B"
                              }
                            ],
                            "party": [
                              {
                                "partyRole": "PROSECUTING_AUTHORITY",
                                "organisationDetails": {
                                  "organisationName": "Pro_Auth"
                                }
                              },
                              {
                                "partyRole":"DEFENDANT",
                                "individualDetails":{
                                  "individualForenames":"Forename 1",
                                  "individualSurname":"Surname 1"
                                }
                              }
                            ]
                          }
                        ]
                      }
                    ],
                    "channel": [
                      "Teams",
                      "Attended"
                    ]
                  }
                ],
                "judiciary": [
                  {
                    "johKnownAs": "Judge TestName Presiding",
                    "isPresiding": true
                  },
                  {
                    "johKnownAs": "Judge TestName",
                    "isPresiding": false
                  }
                ]
              }
            ]
          }
        ]
      }
    }
  ]
}
